{
  "$schema": "https://json-schema.org/draft/2020-12/schema",
  "$id": "https://vexil-lang.org/release/exercises/revocation-exercise-result.json",
  "exerciseSchema": "https://vexil-lang.org/release/schemas/revocation-exercise.schema.json",
  "version": "1.0",
  "recordId": "REV-2026-07-22-RESULT-SUCCESS",
  "recordKind": "revocation-exercise-result",
  "status": "executed-success",
  "scope": "Two distinct disposable read-only repository deploy keys for vexil-lang/vexil were created, authenticated, revoked, and then proved absent and unable to authenticate. No active production identity was used.",
  "safetyBoundary": {"target": "approved-non-production-test-identity-or-individually-reviewed-reversible-path", "requiredPrecondition": "The approved plan limited the exercise to two newly generated read-only repository deploy keys, exact immutable key identifiers, sanitized public fingerprints, and post-revocation SSH-denial and metadata-absence checks.", "prohibitedEffects": ["active production identity disruption", "tag creation or mutation", "GitHub release changes", "package publication", "deployment", "repository content mutation", "Manifest approval", "publication approval", "risk acceptance", "evidence rewrite", "completion declaration"], "stopCondition": "Stop before or immediately after a provider call if a target is not vexil-lang/vexil, a key is not disposable and read-only, the API response does not confirm the expected identity, any active credential would be touched, an expected denial cannot be verified, or a prohibited effect is possible."},
  "participants": [{"actorId": "github:furkanmamuk", "assertedRole": "repository-administrator", "assignmentId": "assignment-repository-administrator-2026-07-14"}],
  "events": [{"eventId": "REV-EVENT-01", "atUtc": "2026-07-22T16:03:57.594Z", "targetSlot": "key-a", "action": "preflight-absence", "outcome": "No matching disposable exercise key was present before creation.", "providerMethod": "GET", "providerReference": "/repos/vexil-lang/vexil/keys?per_page=100"}, {"eventId": "REV-EVENT-02", "atUtc": "2026-07-22T16:04:30.000Z", "targetSlot": "key-a", "action": "created", "outcome": "Disposable read-only deploy key was created and its immutable identity and public fingerprint were verified.", "providerMethod": "POST", "providerReference": "/repos/vexil-lang/vexil/keys", "keyId": 158046146, "keyFingerprint": "SHA256:xLrBgdrHGO4uFLRYbnHSWDWsNojXpHXLW0hA8ITHBmI"}, {"eventId": "REV-EVENT-03", "atUtc": "2026-07-22T16:05:01.840Z", "targetSlot": "key-a", "action": "authenticated", "outcome": "SSH deploy-key authentication was accepted before revocation.", "providerMethod": "SSH", "providerReference": "ssh://git@github.com/vexil-lang/vexil", "keyId": 158046146, "keyFingerprint": "SHA256:xLrBgdrHGO4uFLRYbnHSWDWsNojXpHXLW0hA8ITHBmI"}, {"eventId": "REV-EVENT-04", "atUtc": "2026-07-22T16:05:13.769Z", "targetSlot": "key-a", "action": "revoked", "outcome": "The exact disposable deploy key was deleted by immutable key id.", "providerMethod": "DELETE", "providerReference": "/repos/vexil-lang/vexil/keys/158046146", "keyId": 158046146}, {"eventId": "REV-EVENT-05", "atUtc": "2026-07-22T16:05:14.852Z", "targetSlot": "key-a", "action": "denied", "outcome": "SSH deploy-key authentication was denied after revocation.", "providerMethod": "SSH", "providerReference": "ssh://git@github.com/vexil-lang/vexil", "keyId": 158046146}, {"eventId": "REV-EVENT-06", "atUtc": "2026-07-22T16:05:15.330Z", "targetSlot": "key-a", "action": "metadata-absent", "outcome": "The deleted deploy-key metadata endpoint returned 404.", "providerMethod": "GET", "providerReference": "/repos/vexil-lang/vexil/keys/158046146", "keyId": 158046146}, {"eventId": "REV-EVENT-07", "atUtc": "2026-07-22T16:05:29.384Z", "targetSlot": "key-b", "action": "preflight-absence", "outcome": "No matching disposable exercise key was present before creation.", "providerMethod": "GET", "providerReference": "/repos/vexil-lang/vexil/keys?per_page=100"}, {"eventId": "REV-EVENT-08", "atUtc": "2026-07-22T16:05:44.000Z", "targetSlot": "key-b", "action": "created", "outcome": "Disposable read-only deploy key was created and its immutable identity and public fingerprint were verified.", "providerMethod": "POST", "providerReference": "/repos/vexil-lang/vexil/keys", "keyId": 158046272, "keyFingerprint": "SHA256:4ziGlUEwkudeeIpkjX4RSaEAPi+s2a1oNwEnznKQBwA"}, {"eventId": "REV-EVENT-09", "atUtc": "2026-07-22T16:05:54.019Z", "targetSlot": "key-b", "action": "authenticated", "outcome": "SSH deploy-key authentication was accepted before revocation.", "providerMethod": "SSH", "providerReference": "ssh://git@github.com/vexil-lang/vexil", "keyId": 158046272, "keyFingerprint": "SHA256:4ziGlUEwkudeeIpkjX4RSaEAPi+s2a1oNwEnznKQBwA"}, {"eventId": "REV-EVENT-10", "atUtc": "2026-07-22T16:06:05.629Z", "targetSlot": "key-b", "action": "revoked", "outcome": "The exact disposable deploy key was deleted by immutable key id.", "providerMethod": "DELETE", "providerReference": "/repos/vexil-lang/vexil/keys/158046272", "keyId": 158046272}, {"eventId": "REV-EVENT-11", "atUtc": "2026-07-22T16:06:06.733Z", "targetSlot": "key-b", "action": "denied", "outcome": "SSH deploy-key authentication was denied after revocation.", "providerMethod": "SSH", "providerReference": "ssh://git@github.com/vexil-lang/vexil", "keyId": 158046272}, {"eventId": "REV-EVENT-12", "atUtc": "2026-07-22T16:06:07.216Z", "targetSlot": "key-b", "action": "metadata-absent", "outcome": "The deleted deploy-key metadata endpoint returned 404.", "providerMethod": "GET", "providerReference": "/repos/vexil-lang/vexil/keys/158046272", "keyId": 158046272}],
  "evidence": {"secretsIncluded": false, "providerAuditReference": "GitHub repository deploy-key REST lifecycle and SSH authentication/denial observations for immutable key ids 158046146 and 158046272; Key A creation time is local execution chronology because the organization audit-log endpoint was unavailable", "stableEvidenceDigest": "sha256:272dc56da5ccbb730d6b05c0eea309ff4deb93cf2137abb6ace210adaa191293", "outcome": "Executed successfully. Both disposable read-only keys authenticated only before exact-ID revocation; each then produced SSH denial and a 404 metadata check. Local ephemeral key material was deleted."},
  "publicationReadiness": "blocked"
}
